{
  "$schema": "https://json-schema.org/draft/2020-12/schema",
  "$id": "https://academy.dtfseeds.com/schemas/question.schema.json",
  "title": "THC Academy Assessment Item",
  "type": "object",
  "required": [
    "id",
    "version",
    "status",
    "purpose",
    "competency",
    "objective",
    "bloomLevel",
    "difficulty",
    "type",
    "stem",
    "correct",
    "rationale",
    "references"
  ],
  "properties": {
    "id": {
      "type": "string",
      "pattern": "^ITEM-[A-Z0-9-]+$"
    },
    "version": {
      "type": "integer",
      "minimum": 1
    },
    "status": {
      "enum": [
        "draft",
        "technical-review",
        "editorial-review",
        "pilot",
        "active",
        "flagged",
        "retired"
      ]
    },
    "purpose": {
      "enum": [
        "practice",
        "formative",
        "summative",
        "credential"
      ]
    },
    "competency": {
      "type": "string",
      "pattern": "^COMP-[A-Z0-9-]+$"
    },
    "objective": {
      "type": "string",
      "pattern": "^LO-[A-Z0-9-]+$"
    },
    "bloomLevel": {
      "enum": [
        "remember",
        "understand",
        "apply",
        "analyze",
        "evaluate",
        "create"
      ]
    },
    "difficulty": {
      "enum": [
        "easy",
        "moderate",
        "hard",
        "expert"
      ]
    },
    "type": {
      "enum": [
        "multiple-choice",
        "multiple-response",
        "numeric",
        "ordering",
        "matching",
        "scenario",
        "case-study",
        "short-response"
      ]
    },
    "stem": {
      "type": "string",
      "minLength": 5
    },
    "choices": {
      "type": "array",
      "minItems": 2,
      "items": {
        "type": "string",
        "minLength": 1
      }
    },
    "correct": {
      "anyOf": [
        {
          "type": "integer",
          "minimum": 0
        },
        {
          "type": "array",
          "minItems": 1,
          "uniqueItems": true,
          "items": {
            "type": "integer",
            "minimum": 0
          }
        },
        {
          "type": "number"
        },
        {
          "type": "string",
          "minLength": 1
        },
        {
          "type": "array",
          "minItems": 1,
          "items": {
            "type": "string",
            "minLength": 1
          }
        }
      ]
    },
    "rationale": {
      "type": "string",
      "minLength": 5
    },
    "references": {
      "type": "array",
      "minItems": 1,
      "uniqueItems": true,
      "items": {
        "type": "string",
        "pattern": "^REF-[A-Z0-9-]+$"
      }
    },
    "stimulus": {
      "type": "array",
      "minItems": 1,
      "items": {
        "type": "object",
        "required": [
          "type"
        ],
        "properties": {
          "type": {
            "type": "string",
            "minLength": 1
          }
        },
        "additionalProperties": true
      }
    },
    "extensions": {
      "type": "object",
      "additionalProperties": true
    },
    "matchPrompts": {
      "type": "array",
      "minItems": 2,
      "items": {
        "type": "object",
        "required": [
          "id",
          "text"
        ],
        "properties": {
          "id": {
            "type": "string",
            "pattern": "^[A-Z0-9][A-Z0-9_-]*$"
          },
          "text": {
            "type": "string",
            "minLength": 1
          }
        },
        "additionalProperties": false
      }
    },
    "matchOptions": {
      "type": "array",
      "minItems": 2,
      "items": {
        "type": "object",
        "required": [
          "id",
          "text"
        ],
        "properties": {
          "id": {
            "type": "string",
            "pattern": "^[A-Z0-9][A-Z0-9_-]*$"
          },
          "text": {
            "type": "string",
            "minLength": 1
          }
        },
        "additionalProperties": false
      }
    }
  },
  "allOf": [
    {
      "if": {
        "properties": {
          "type": {
            "enum": [
              "multiple-choice",
              "scenario",
              "case-study"
            ]
          }
        },
        "required": [
          "type"
        ]
      },
      "then": {
        "required": [
          "choices"
        ],
        "properties": {
          "correct": {
            "type": "integer",
            "minimum": 0
          }
        }
      }
    },
    {
      "if": {
        "properties": {
          "type": {
            "const": "multiple-response"
          }
        },
        "required": [
          "type"
        ]
      },
      "then": {
        "required": [
          "choices"
        ],
        "properties": {
          "correct": {
            "type": "array",
            "minItems": 1,
            "uniqueItems": true,
            "items": {
              "type": "integer",
              "minimum": 0
            }
          }
        }
      }
    },
    {
      "if": {
        "properties": {
          "type": {
            "const": "numeric"
          }
        },
        "required": [
          "type"
        ]
      },
      "then": {
        "properties": {
          "correct": {
            "type": "number"
          }
        }
      }
    },
    {
      "if": {
        "properties": {
          "type": {
            "const": "short-response"
          }
        },
        "required": [
          "type"
        ]
      },
      "then": {
        "properties": {
          "correct": {
            "type": "string",
            "minLength": 1
          }
        }
      }
    },
    {
      "if": {
        "properties": {
          "type": {
            "const": "ordering"
          }
        },
        "required": [
          "type"
        ]
      },
      "then": {
        "required": [
          "choices"
        ],
        "properties": {
          "correct": {
            "type": "array",
            "minItems": 2,
            "uniqueItems": true,
            "items": {
              "type": "integer",
              "minimum": 0
            }
          }
        }
      }
    },
    {
      "if": {
        "properties": {
          "type": {
            "const": "matching"
          }
        },
        "required": [
          "type"
        ]
      },
      "then": {
        "required": [
          "matchPrompts",
          "matchOptions"
        ],
        "properties": {
          "correct": {
            "type": "array",
            "minItems": 2,
            "items": {
              "type": "string",
              "pattern": "^[A-Z0-9][A-Z0-9_-]*$"
            }
          }
        }
      }
    }
  ],
  "additionalProperties": false
}
