{"id":"ITEM-TECH2-TRACE-012","version":1,"status":"draft","purpose":"credential","competency":"COMP-CROP-PLAN-001","objective":"LO-CROP-RECORDS-003","bloomLevel":"analyze","difficulty":"hard","type":"scenario","stem":"A quantity discrepancy appears only after a waste event. Which record should be prioritized?","choices":["Waste amount, authorization, timestamp, source identity, and resulting balance","Only the final balance","Only the worker name","A new harvest record"],"correct":0,"rationale":"The event directly preceding the discrepancy should be reconstructed with its quantity and genealogy evidence.","references":["REF-POSTHARVEST-001"]}