{
  "id": "ITEM-LH-TECH1-001-M01-001",
  "version": 1,
  "status": "draft",
  "purpose": "formative",
  "competency": "COMP-SAFETY-WORK-001",
  "objective": "LO-LH-TECH1-001-01",
  "bloomLevel": "apply",
  "difficulty": "moderate",
  "type": "scenario",
  "stimulus": [
    {
      "type": "image",
      "assetId": "VIS-LH-TECH1-001-021",
      "src": "/assets/course1/hazard-scan.png",
      "alt": "Illustrated cultivation work area with several representative hazards and control concerns, including a wet travel path near powered equipment, damaged electrical equipment, an obstructed aisle, and other conditions that should be evaluated before work continues.",
      "caption": "Use the work-area scan as evidence. Focus on the condition described in the question rather than assuming every illustrated condition has equal urgency."
    }
  ],
  "stem": "A wet aisle is spreading toward a powered device with visible cord damage. What is the best Technician I response?",
  "choices": [
    "Stop the task, prevent exposure if authorized, and escalate the electrical hazard",
    "Step around the water and continue working",
    "Dry the floor but keep using the damaged device",
    "Open the device and inspect the wiring"
  ],
  "correct": 0,
  "rationale": "Water and damaged electrical equipment create an unsafe condition. Technician I should control exposure within authorization and escalate rather than perform unauthorized electrical work.",
  "references": [
    "REF-NIOSH-CANNABIS-HAZARDS-2024",
    "REF-OSHA-1910-22-WALKING"
  ]
}
