{
  "id": "ITEM-LH-TECH1-004-005",
  "version": 1,
  "status": "draft",
  "purpose": "summative",
  "competency": "COMP-ROOTZONE-001",
  "objective": "LO-LH-TECH1-004-02",
  "bloomLevel": "analyze",
  "difficulty": "moderate",
  "type": "scenario",
  "stem": "A container has one moisture reading immediately before irrigation. What can the technician conclude about dryback rate?",
  "choices": [
    "A single point is insufficient; repeated comparable observations are needed to describe the trajectory",
    "The exact dryback rate is known",
    "The media is too dry by definition",
    "The irrigation interval is automatically correct"
  ],
  "correct": 0,
  "rationale": "A single point is insufficient; repeated comparable observations are needed to describe the trajectory. This preserves the Course 004 measurement, root-zone, nutrition, work-order, equipment or record-quality principle being assessed.",
  "references": [
    "REF-IRRIGATION-001"
  ],
  "extensions": {
    "courseId": "COURSE-LH-TECH1-004",
    "itemSet": "course4-v1"
  }
}
