{"id":"ITEM-CRED-SAFETY-026","version":1,"status":"draft","purpose":"credential","competency":"COMP-RESPONSIBLE-LEGAL-001","objective":"LO-LEGAL-LABEL-002","bloomLevel":"analyze","difficulty":"hard","type":"scenario","stem":"A product is labeled for a crop category, but the facility's specific use site and application method are unclear. What is the strongest decision?","choices":["Confirm that the current label and applicable jurisdiction specifically permit the intended site, method, timing, and crop use before application","Assume crop-category wording permits every application method","Use a lower rate without checking the use site","Apply only at night so the label question no longer matters"],"correct":0,"rationale":"Legal use depends on the complete labeled directions and applicable requirements, not merely the presence of a broadly related crop term.","references":["REF-LEGAL-USDA-001"]}