{"id":"ITEM-GENETICS-012","version":1,"status":"draft","purpose":"summative","competency":"COMP-GENETICS-001","objective":"LO-GENETICS-001","bloomLevel":"analyze","difficulty":"moderate","type":"scenario","stem":"The same clone develops different architecture in two environments. What does this demonstrate?","choices":["Phenotype can change with environment even when genotype is the same","Genotype must have changed because phenotype changed","Clones are never genetically related","Environment cannot affect architecture"],"correct":0,"rationale":"Phenotype reflects genotype interacting with environment and developmental context.","references":["REF-GENETICS-001","REF-CANOPY-001"]}