{"id":"ITEM-TECH2-PROP-009","version":1,"status":"draft","purpose":"credential","competency":"COMP-PROP-001","objective":"LO-PROP-CLONE-003","bloomLevel":"apply","difficulty":"moderate","type":"numeric","stem":"A batch begins with 120 cuttings. Ninety-six become acceptable rooted plants. What percentage becomes acceptable rooted plants?","correct":80,"rationale":"96 / 120 x 100 = 80%.","references":["REF-PROP-001"]}