{"id":"ITEM-CRED-RESILIENCE-026","version":1,"status":"draft","purpose":"credential","competency":"COMP-OUTDOOR-RISK-001","objective":"LO-OUT-WEATHER-002","bloomLevel":"analyze","difficulty":"hard","type":"scenario","stem":"After a storm, one block shows stem damage while another protected by windbreaks does not. What should be evaluated before copying the windbreak design everywhere?","choices":["Wind direction, turbulence, shading, moisture retention and disease tradeoffs as well as structural protection","Only the number of plants saved","Only fertilizer rate","Assume windbreaks have no disadvantages"],"correct":0,"rationale":"Wind protection can alter other microclimate variables, so benefits and tradeoffs should be evaluated together.","references":["REF-OUTDOOR-OSU-001","REF-OUTDOOR-PSU-001"]}