{"id":"ITEM-TECH2-SENSOR-014","version":1,"status":"draft","purpose":"credential","competency":"COMP-ENV-ADV-001","objective":"LO-ENV-AIRFLOW-002","bloomLevel":"analyze","difficulty":"hard","type":"scenario","stem":"Room-average RH is stable, but repeated mapping shows one canopy corner consistently higher than the rest. What does the average fail to show?","choices":["The room name","A persistent spatial distribution problem","The crop cultivar","The controller firmware version"],"correct":1,"rationale":"Averages can conceal local microclimates; spatial mapping is needed to identify persistent distribution differences.","references":["REF-VPD-002","REF-ENV-TEMP-2025-001"]}