{"id":"ITEM-CRED-WATER-030","version":1,"status":"draft","purpose":"credential","competency":"COMP-IRRIGATION-ADV-001","objective":"LO-IRR-MASSBAL-003","bloomLevel":"evaluate","difficulty":"hard","type":"scenario","stem":"Applied volume is unchanged, but drain volume falls while root-zone EC rises. What is the strongest systems interpretation?","choices":["Less leachate and greater concentration may be occurring, so water balance and delivery should be investigated together","The nutrient recipe is automatically too weak","The measurements cannot be related","More fertilizer should be added immediately"],"correct":0,"rationale":"Lower drainage and rising root-zone EC can be linked through water and solute balance and should be evaluated together.","references":["REF-IRRIGATION-001","REF-ROOTZONE-NUTRIENT-002"]}