{"id":"ITEM-TECH2-SENSOR-005","version":1,"status":"draft","purpose":"credential","competency":"COMP-ENV-ADV-001","objective":"LO-ENV-MAP-001","bloomLevel":"evaluate","difficulty":"hard","type":"scenario","stem":"A two-hour data gap overlaps a suspected environmental excursion. How should that affect the investigation?","choices":["Assume conditions were normal during the gap","Document the missing data as uncertainty and use other evidence without inventing values","Fill the gap with the nearest reading","Delete the entire trend"],"correct":1,"rationale":"Missing data reduce certainty and should be documented rather than silently imputed as fact.","references":["REF-ENV-TEMP-2025-001"]}