{
  "id": "ITEM-LH-PHIB-005-007",
  "version": 1,
  "status": "draft",
  "purpose": "summative",
  "type": "scenario",
  "objective": "LO-LH-PHIB-005-03",
  "competency": "COMP-IPM-ADV-001",
  "bloomLevel": "evaluate",
  "difficulty": "hard",
  "stem": "Fungus-gnat pressure repeatedly increases in chronically wet media. Which control strategy best addresses the underlying system?",
  "choices": [
    "Correct the moisture/source condition while using appropriate monitoring and authorized direct controls.",
    "Increase irrigation further.",
    "Ignore the media because only adult insects matter.",
    "Use a stronger pesticide regardless of label."
  ],
  "correct": 0,
  "rationale": "Cultural control should address the biological source condition as part of integrated management.",
  "references": [
    "REF-OSU-GREENHOUSE-IPM-001"
  ],
  "extensions": {
    "specialistCourse": "COURSE-LH-PHIB-005",
    "seedBank": true
  }
}
