{
  "id": "ITEM-LH-TECH2-004-M01-005",
  "version": 1,
  "status": "draft",
  "purpose": "formative",
  "competency": "COMP-PRO-QA-001",
  "objective": "LO-LH-TECH2-004-05",
  "bloomLevel": "apply",
  "difficulty": "moderate",
  "type": "scenario",
  "stem": "What should happen to an inconvenient but valid scouting observation?",
  "choices": [
    "Keep it in the record and interpret it with the rest of the evidence.",
    "Delete it if it conflicts with the leading hypothesis.",
    "Move it to another round.",
    "Replace it with the room average."
  ],
  "correct": 0,
  "rationale": "Keep it in the record and interpret it with the rest of the evidence.",
  "references": [
    "REF-MHRA-GXP-DATA-INTEGRITY"
  ]
}
