{"id":"ITEM-HOME-GROW-FINAL-001","version":1,"status":"draft","purpose":"summative","competency":"COMP-HOME-START-001","objective":"LO-HOME-SCOPE-001","bloomLevel":"analyze","difficulty":"moderate","type":"scenario","stem":"A new home grower has space for several plants but has not verified local rules, electrical capacity, or drying space. What is the strongest next step?","choices":["Define legal, safety, space, environmental, and post-harvest constraints before starting plants","Buy the maximum number of plants first","Choose equipment based only on advertised plant count","Ignore drying and storage until harvest"],"correct":0,"rationale":"A defensible home-grow plan begins by defining the legal, safety, infrastructure, and workflow constraints that limit the project.","references":["REF-LEGAL-USDA-001","REF-SAFETY-OSHA-001"],"extensions":{"courseFinalProfile":"public-noncredential-dedicated-bank","sourceItemId":"ITEM-CRED-HOME-001","sourceBranch":"origin/content/home-grow-final-assessment","certificationUseStatus":"not-authorized"}}
