{
  "id": "ITEM-LH-TECH2-001-M01-008",
  "version": 1,
  "status": "draft",
  "purpose": "formative",
  "competency": "COMP-PRO-QA-001",
  "objective": "LO-LH-TECH2-001-01",
  "bloomLevel": "analyze",
  "difficulty": "hard",
  "type": "scenario",
  "stem": "Formative diagnostic check 8: A supervisor asks for the “confirmed cause” while two leading hypotheses remain plausible. What should the technician report?",
  "choices": [
    "Choose the more familiar diagnosis so the report is decisive.",
    "Call both causes confirmed.",
    "Remove the weaker hypothesis from the record without explanation.",
    "State the leading hypotheses, confidence, evidence for and against each, and the next discriminating check."
  ],
  "correct": 3,
  "rationale": "Diagnostic reporting should match certainty to evidence and preserve unresolved alternatives.",
  "references": [
    "REF-IPM-GREENHOUSE-2024-001"
  ]
}
