{
  "id":"ITEM-FOUND-OBJ-NUT-MACRO-002","version":1,"status":"draft","purpose":"summative","competency":"COMP-NUTRITION-001","objective":"LO-NUTRITION-MACRO-002","bloomLevel":"analyze","difficulty":"hard","type":"scenario","stem":"A grower substantially increases potassium while source water and root-zone pH remain stable, then sees symptoms consistent with reduced magnesium availability. Which mechanism deserves investigation?","choices":["Cation competition or nutrient imbalance associated with the potassium increase.","A guarantee that magnesium is absent from the fertilizer.","Photoperiod alone.","The idea that macronutrients never interact."],"correct":0,"rationale":"Nutrient availability and uptake can be influenced by interactions among cations; a large potassium change can be relevant when evaluating magnesium-like symptoms.","references":["REF-NUTRITION-001"]
}
